984371798170132480,Trade liberalisation in Central America has allowed regional value chains in the region to form; these linkages hav… https://t.co/qrCZLFHUbu
986222570285518849,"@mittensandtinyd @nytimes International trade in ivory is banned but many countries still permit domestic trade, in… https://t.co/dnl0aXmx7s"
982729208576270336,@realDonaldTrump You are the most fucking ignorant @POTUS in history. Learn how international trade works.
983586070049775617,"As the 🇺🇸 gets increasingly skeptical about free international trade, 🇨🇳 increases its commitment with it. https://t.co/D0H7wmUI0W"
984823545606955008,"As a #smallbusiness owner you may be ready to expand in the global market place to experience growth, increase reve… https://t.co/nQkAVQtt2t"
983684096131059713,"#Dollar gains versus #Yen as risk appetite improves after Xi speech.

The dollar bounced vs the yen, with broader r… https://t.co/gLPuMa2gw5"
985694282400108549,Ambassador Dr. Clarence Henry is returning to the board of the Caribbean Export Development Agency as Antigua and B… https://t.co/YnhM5mfwer
986277950076186624,"Gender,Children and Social Protection meets with the  Executive Director of the International Trade Center on the m… https://t.co/LzW7JsqOAx"
983632700589379584,"China Ready To Lower Import Tariffs And Trade Barriers, Xi Says https://t.co/Qv3l7QjgPD"
985812610439315456,British PM @theresa_may announces new UK Commonwealth trade  programs including SHEtrades to boost women's particip… https://t.co/fNgDY3Hi7v
984147685568667660,Australian sheep bound for the Middle East 'cooked alive in harrowing and deadly conditions' on live export ships |… https://t.co/Cyld2UQ19e
984205146409373696,@TristinHopper Doug Ford would do well out there. We in Ontario would export him to Alberta but sadly the interprov… https://t.co/Q9QtnCnCXK
983667247033053184,Xi Says China To Lower Trade Barriers As Beijing Files WTO Complaint Against U.S. https://t.co/UEWhNeJFdG
984971215046627330,The African Continental Free Trade Area (AfCFTA): Overcoming The Dominance of International Finance Capital… https://t.co/z35gJfvMgY
985889437405114369,@LizEconomy Is there a tariff on the import of students from PRC to US Universities? There certainly is a huge “tra… https://t.co/by1E1hyJbQ
985117822404775937,"international human trade
https://t.co/SHiHmcd5Sw https://t.co/tBACN1KHXG"
984118397276426241,Canadian Whisky amongst Manitoba's highest value-added processed agri-food export #trade #Cndpoli #MB… https://t.co/koggue6klr
983752935447384066,".@GovAbbott to @CNBC @SquawkCNBC re: #Nafta, ""#Texas has a lot on the line here, we export almost $100 billion wort… https://t.co/tzggnXbaQo"
983314414991499266,"China is considering a range of options to counter U.S. tariff measures, including devaluing the yuan. https://t.co/tmnSPkQCnX"
984497030646165504,"working on a paper about international trade and some other bullshit, never thought this would take a lot of fucking time"
984758747162492928,Oops. 😳  https://t.co/Qj04rdfIkM
984760461596880896,"#BreakfastRoundTable  #TTEconomy   #EconomicTransformation   #TTChamber   #RiannaPaul  
IN STUDIO NOW…
RIANNA PAUL… https://t.co/D8M57VI8Y6"
983934993457131521,@realDonaldTrump Hey dump instead of going to trade war why don’t you eliminate the Shipping cost from tax deductio… https://t.co/7kR8vSs6A7
983455554344505345,A negative balance of trade is not the same as losing in int. trade. Import tariffs and trade wars can break down t… https://t.co/IWrChdwN0u
985832811537031169,UK Int'l Trade Minister @LiamFox: UK and International Centre to launch new global analysis to build understanding… https://t.co/TMAWHg3YA4
983258812365922305,"@CNBC I think this could become bitcoins primary role, it’s the worlds first independent digital currency that is n… https://t.co/GFmkJUAqi4"
983036122338152449,"As U.S. and China trade tariff barbs, others scoop up U.S. soybeans | Reuters #tarrifs  https://t.co/1cyaPKf9ZD"
985956386998706176,"No matter how the #US-#China #TradeWar ends, the West is no longer prepared to tolerate China’s dishonesty in inter… https://t.co/QaVrqrINkb"
983613395600596992,Chinese President Xi Jinping promises to open the country’s economy further and lower import tariffs on products in… https://t.co/FSyqMShl3d
985687742293082117,"""China resumes economic talks with Japan as global trade fears flare"" https://t.co/xtwOzvhv7p"
984802388048523264,What Does the Due Diligence Process Look like In a Trade Export Finance Transaction? https://t.co/QkDPd71Wdf
985570157333393408,European Commission developing plan to offer Trump the prospect of a trade deal with the EU in exchange for a perma… https://t.co/9eRU8JDK5X
983546761259159552,"Excellent biz visit to sprawling, thriving, vibrant &amp; historic Mexico City, home to 22 million wonderful people, wi… https://t.co/G3fQ0IajNw"
984490305570398211,"SO, MORON WAS WRONG

#Trump weighs rejoining Trans-Pacific Partnership amid trade dispute with #China

WHO WOULD HA… https://t.co/oVYrtSR7LY"
985233509508894721,Desde CamSCAT felicitamos a @Procomer_CR por mantener el primer lugar mundial entre promotoras de comercio definido… https://t.co/TR07AUNML5
983315764785635328,"China Is Studying Yuan Devaluation as a Tool in Trade Spat.  ""While a weaker yuan could help President Xi Jinping s… https://t.co/NsIz4Jvoa5"
986210241091076104,"In Latest Trade Salvo, China Imposes 179 Percent Tariff On U.S. Sorghum https://t.co/rJr3yk5KrC"
983394879958110208,"@GusVillegas If the establishment truly wants free trade, all it has to do is to repeal our numerous tariffs, impor… https://t.co/pHUpedY65p"
984843418642862080,"The following letter was co-signed by 11 organisations, now more on board. It was sent to @ErikSolheim @UNEP @CITES… https://t.co/SMRnKG1O6F"
984687696168833024,Trade war backfire: Steel tariff shrapnel hits U.S. farmers https://t.co/VHiJ2YremL Reuters
984924308614123520,"Desde CLC extendemos nuestra felicitación a @Procomer_CR por haber obtenido por cuarto año consecutivo, el primer l… https://t.co/xI6VIOZ2XU"
983246287687573504,“If the major creditor countries left their tariff rates unchanged and instead decided to sell their holdings of US… https://t.co/U2N1eeKWZP
984947241176764416,Queremos felicitar a la Promotora del Comercio Exterior de Costa Rica (PROCOMER) por lograr el primer lugar en el r… https://t.co/wN9arbMAis
983693660662452224,The development of national and international trade has made Miami an #idealcity to live. Ready to start in… https://t.co/8kPXn1V5ZE
985869918586458112,Tube in Düsseldorf is the world's most important trade fair for the tube and tube processing industry and the centr… https://t.co/fEjydNuXtS
982971365992124416,Sarah Sanders said Trump 'is the best negotiator at the table' and everyone made the same joke https://t.co/QE7JqcDhQX
983697193998536706,"Dried swim bladders of the nearly #extinct #totoaba fish, which despite an international trade #ban can still be fo… https://t.co/b0xj8KpVoC"
983519784514994176,It’s also incredibly uncomfortable when you realize the people pushing for better work conditions in developing cou… https://t.co/0N6jbQqbkX
983395657129086976,"Trump Explains:
""When a car is sent to the US from China, there is a Tariff to be paid of 2 1/2%, ""When a car is se… https://t.co/kgxmOhFs4c"
985183965811232768,@realDonaldTrump International trade is hard.
984783752566996992,"#TradeWar backfire: 

Steel tariff shrapnel hits U.S. farmers
 https://t.co/yLXHMJEYvM #MAGA"
982652709332508672,@MarketWatch U better hope China US trade wars cease as tariffs will impact those returns. Problem is we may get fo… https://t.co/JmPgC84q2p
984274980216197121,The trade balance between me and my neighbor is about zero. I import pepper sauce from my neighbor and export tech services to my neighbor.
984103285534724096,CITES (the Convention on International Trade in Endangered Species of Wild Fauna and Flora): Return native endanger… https://t.co/B7X08qbzou
983774580249649153,"INTERNATIONAL TRADE OF TEAK &amp; HARD WOOD : 
_____________________________

+507 66532286 teak whatsapp
cocoboloexpor… https://t.co/FpqKhUug1t"
984802723987107841,Visualizing How Vulnerable is Each State to a Trade War https://t.co/S7zHY54jyy
986021117163855874,How did he think threatening the EU &amp; Canada will turn out? It’s one thing to insist on renegotiation of trade deal… https://t.co/6p1a2UG50s
986245274271141888,Thanks a lot President Trump... https://t.co/cugwtbmaYO #sorghum #tariffs
986267555076759552,Our latin-american countries need more trade than aid. We have so many goods to export to other latitudes. Free market is the way!
984721974147665920,Steel tariff hits U.S. farmers as backlash from trade war bites https://t.co/AJQCUbvvc9 https://t.co/VG7LGMUvzd Reuters
982837236105449472,"@NYTNational yellow journalism ,why don't you look at the whole big picture , China has no respect for internationa… https://t.co/S5PALGPXwO"
984230888413200384,"This Community Manager is running out of cheeky comments to make about @realDonaldTrump  and #China, really 😐… https://t.co/Qd10nabcha"
984897536568778754,Trade war backfire: Steel tariff shrapnel hits U.S. farmers https://t.co/NpqzVeAHrV
983440321139888128,How did china become economically powerful? By demanding a 25% tariff on all imports from America and enjoying a 2.… https://t.co/jnWozteHlI
983357014133878785,"HONG KONG
W/ an area of 1,104 km2, more than 7million inhabitants, a central location in east Asia and with a rapid… https://t.co/J9uWflf5Vc"
982804863087149057,Cost of Possible US-China Trade War Becomes More Apparent - Analysts https://t.co/dtFAFx4uWB
984518889878052864,@mike_Zollo 🤣🤣🤣🤣🤣🤣🤣 And your expertise as a international trade specialist is best shown by your Maga cap.
984831083702378496,"Hercules will be at the 'Partners in Prevention Trade Show and Conference' May1-2, Booth #606 at the The Internatio… https://t.co/YCUnQxvj87"
983975846200446978,“We can't allow trade talks to undermine efforts to tackle childhood obesity. Children's health outcomes are much w… https://t.co/g14ioUCFzW
983440895679848448,CITES (the Convention on International Trade in Endangered Species of Wild Fauna and Flora): Return native endanger… https://t.co/nkriucUFWN
983384388112207872,@realDonaldTrump It wouldn’t happen if u didn’t put a tariff on Chinese imports and started a trade war u idiot
983045381171884032,"[4/8, 2:09 PM] David Miranda: https://t.co/xxUw9c9Hpd

Trump poniendo a China en cintura; y de paso, realinieando los mercados mundiales."
985099014046670848,"#Spain 32% off, 5.0 Stars: Silln Elevador Butaca Levantapersonas  Modelo Relax Trade Color. Details: Material: Poli… https://t.co/NoX5eOAfro"
985470640454062080,"Antigua and Barbuda Minister of Foreign Affairs, International Trade and Immigration Hon. E.P. Chet Greene meets wi… https://t.co/YMUnzqs97e"
983600774587600896,"Stock rally as Chinese President Xi Jinping promises to lower import tariffs, helping to soothe investor jitters ov… https://t.co/XtzG8WGTKT"
983690555862470657,China's president offers US possible trade concessions https://t.co/9D4ETPCDTy
983061957703094272,Sarah Sanders said Trump 'is the best negotiator at the table' and everyone made the same joke https://t.co/QE7JqcDhQX
986214052316794882,"In Latest Trade Salvo, China Imposes 179 Percent Tariff On U.S. Sorghum https://t.co/0eDkzHfqBv"
983715664971157504,Canada and other countries that rely on a stable world trading order that includes abiding by the WTO and other int… https://t.co/vekvD1kSjW
984804820757417984,"#Digimon Digi-Pals beanie plushies #FORSALE!
#Patamon - $40 shipped to US / $30 +shipping international
#Tokomon -… https://t.co/di0q0sPs6M"
984891728778940416,U.S. to export pork to Argentina under new rules after 26 years https://t.co/Th2zveKZjZ
983348693347774464,@Integrationc18 Small countries are richer because they invest money on things that improve quality of life: educat… https://t.co/LJf4mnRr9f
985126085397565441,BPA has a ceiling determined by the bilateral trade. Least amount in bilateral trade between Iran and South Korea i… https://t.co/M3MfqlFjG5
984992913192046593,Establishing good diplomatic relations is good business when every developing nation and even historical adversary… https://t.co/Nk0EwLrcTV
984411219061886977,Trump wants taxpayers to subsidize farms even more than they are subsidized now.  #tradewar https://t.co/9tAlYHEdN4 https://t.co/6uNMc27sEr
986282867935215616,@cathmckenna @TCS_SDC @Ailish_Campbell @blanchardCanada @FP_Champagne why work on international trade when trade be… https://t.co/eWdPpXjM2S
982829783095611392,@OttawaCitizen China just doesn't import enough from the US to have sufficient trade to even apply tariffs against.
983666893058961410,China’s President Xi Jinping offers U.S. possible trade concessions https://t.co/bveFunDkiX via @usatoday
984425678614552577,"EDC raises its sales projections, despite growing trade tension https://t.co/68iJeeYHuS https://t.co/b4fpPWUUHT"
984656873843458053,@realDonaldTrump TTP partners have no particular impetus to include the US in any deal as that ship has left the pr… https://t.co/0gtG65UGkJ
983372355912327168,Look behind the U.S.-China trade rhetoric and conditions are ripe for a ceasefire https://t.co/m6BaCIlg2x vía @gadfly
983500655309471744,It’s a little ironic that @paulkrugman wrote this. During grad school he wrote most of my international economics t… https://t.co/nnzATjn9ZO
984529955718598656,"In 2017 #Madagascar reached 1,150 billions Euros of export against 600 millions Euros. Positive balance of trade. W… https://t.co/pFJcgOvMYe"
982776305535148032,9 leaders share advice to help women entrepreneurs take their business global https://t.co/6FeyQzTEvK
985278623581179904,"@Panthera_Col Two grant opportunities open for our Combating Wildlife Trafficking Program 
1. Conserving Priority S… https://t.co/aFPa0kKoUF"
985902776981962758,Focus on inside our country Rather than international TRADE. With as many immigrants they want us to HELP AND FOCUS… https://t.co/PXAi2lDVZP
984118574624264192,"48th Annual, 28th and 29th April 2018. 
National Agriculture and Trade Show Line up!!
Mimi Martinez 
X-Band
Ernesti… https://t.co/Ns8sqOJU9V"
983975830480039936,“We can't allow trade talks to undermine efforts to tackle childhood obesity. Children's health outcomes are much w… https://t.co/9Wh5BLrrEe
984775737369653248,4 risks when exporting &amp; how #CreditInsurance can help via @atradiusAU #export #risk #business #trade… https://t.co/EdcExXVGex
982880575332732928,China's state media urges U.S. industry to rally against Trump tariff threat https://t.co/jRVpyKYLjc https://t.co/C90IL8Bmrh Reuters
985148730516099072,Proud of Canada’s role in achieving a historic agreement @IMOHQ on an initial strategy to reduce #GHG emissions lea… https://t.co/5YykbCLsLY
984452110329593857,"Minister of International Trade of Canada round table discussion with aerospace SME reps in MB, to talk about free… https://t.co/Cw3xXTeuKB"
985182848104783873,"Some of the best coffee in the world comes from  Honduras 🇭🇳, Nicaragua 🇳🇮 and Costa Rica 🇨🇷 Not to worry Canada… https://t.co/D8VAN4ybZ5"
983734634981838848,Market forces should determine cement prices in #Uganda. If existing regional and international trade rules are app… https://t.co/usJktjRpD0
985901227023196161,"For the bulls...every geo-political, war mongering, trade tariff headline has been thrown at the markets and the ma… https://t.co/kSBVo9b5hf"
983884313354698752,Trump's Tariff War: 'China's Innovative Power is Unstoppable' – Analysts https://t.co/kAuuksEwQn
984326846446800896,China commerce ministry asserts President Xi Jinping’s pledge to cut import tariffs is not a concession to Washingt… https://t.co/6nvwHBoFNx
982790181060317184,Sarah Sanders said Trump 'is the best negotiator at the table' and everyone made the same joke https://t.co/QE7JqcDhQX
983726251499110400,"Facing trade war with U.S., China’s Xi renews vow to open markets, import more https://t.co/e4iqeb6RC4"
983637677231788032,"Publicly it's a ""trade war"", senseless, stupid, reckless, leftist, protectionist, etc. (insert mass media headline)… https://t.co/51AyfKR7ZZ"
984389596690747392,Israel’s first lady Sara Netanyahu 'appalled' by Australia's live export trade https://t.co/SJ5tGM9x3O
986311333334351872,#Indonesia begins to post surplus in international #trade https://t.co/Bh056A84E0 https://t.co/hwCXFO8PS8
983488334449266688,"@realDonaldTrump When OIL is sent to United States from Mexico, there is a Tariff to be paid of 18-20%. When oil is… https://t.co/n3KkgEiHsx"
984407820476076032,"Trade War Is Risk for Export-Led Southeast Asia, World Bank Says. ""The world’s two biggest economies have threatene… https://t.co/XNmnwscRgQ"
983330697153777664,@kimmielovesnana 😂got news for you..... It's more than half the world he's pissed off ... 😡 Gotta love how some say… https://t.co/gSLaRhbZc2
982734191262666753,China's state media says U.S. tariff action will be defeated | Article [AMP] | Reuters https://t.co/BZThsqiMZQ
984772993015599104,Trade war backfire: Steel tariff shrapnel hits U.S. farmers | #tariffs #Trump  https://t.co/tpzKx0I9Pq
984792445920542722,@adam_tooze We do need to pay more attention to how much of trade deficits are knock on effects. In this case it co… https://t.co/1qC1O7MwFJ
983324583821565953,"Even without a technical knowledge of trade policy, how could you seriously think that fair trade simply means ever… https://t.co/YoFb37qc83"
982684390554783744,"bones or meat, or other products. Legal wildlife trade is regulated by the United Nations' Convention on Internatio… https://t.co/68IcUTQVk2"
985865746403110913,@JMaserati @ndaloisi Doubling licensed production capacity and strengthening international market share. Doesn’t so… https://t.co/tCdbQ7Woeb
982974937051877376,"@globaltimesnews China a communist country has no respect for intellectual property rights  ,also has no respect wh… https://t.co/IbTLsmH3Dl"
984851752297095168,Trade war backfire: Steel tariff shrapnel hits U.S. farmers | Article [AMP] | Reuters https://t.co/RZU6YM6bbK
983610062403981312,Xi Says China Ready To Lower Import Tariffs And Trade Barriers https://t.co/LSbg1aNqQC
983723808166219776,We had a great time with Minister @JeffLeal_MPP and Futurpreneur board member @janicemcd at the Women In Internatio… https://t.co/pOE1OSEUMS
984874390537080832,"EDC raises its sales projections, despite growing trade tension https://t.co/8ewd0QnByv https://t.co/L683tV2iDK"
983402948414853120,The horrific live export trade should be outlawed. A new investigation out of Australia exposes crew members slitti… https://t.co/Mzpfm6YpWE
984101290316726274,"@ayflo @Mochievous @MrBure Yes, it requires certification. And there are quite a lot offered online like CITT, SCMA… https://t.co/v2AbNGeMaF"
983037591694950400,okay so international trade theory is something i've kinda specialized in as an economist so i'm curious: to most p… https://t.co/WGmw8xYsTQ
984205839522136064,Thanks @HiTecAg for showing us your facility in Portage La Prairie &amp; mixers destined for export markets. #trade… https://t.co/chsrfqJFyK
982696271197753345,"If a trade deficit is a loss then no international commerce should ever take place, since every transaction has at least one loser."
983733305928536064,@DailyMonitor Not allowing cheap cement on the whims of the Minister. Market forces of demand and supply should be… https://t.co/MybNrqYCXB
984434812185391104,"“International trade &amp; #NAFTA have never been more popular on the Hill.” -Nate Giordano, @USChamber 

Thanks, Nate… https://t.co/ailThIykxQ"
982628012658253824,International Economics. A wonderful  article written by Joseph Stiglitz about trade inadequate policies implemente… https://t.co/G0e6XeIfOr
983698447604834304,"@realDonaldTrump I agree, however we must be more diplomatic about it with China &amp; begin with negotiating.  That co… https://t.co/KquWPmWIxY"
983414159835475973,BLOG: Should Canadian governments trash international trade deals to protect industries that employ a handful of wo… https://t.co/piiWrdIgDc
983057796932321280,"As U.S. and China trade tariff barbs, others scoop up U.S. soybeans https://t.co/zu7wWf9Wdf"
986262151965929472,"""BEIJING/BRUSSELS (Reuters) - China’s international trade representative held a series of meetings with the ambassa… https://t.co/CNET2XilLl"
983627226322259969,"U.S stock futures rally, Asian equities bounce as Chinese President Xi Jinping promises to lower import tariffs on… https://t.co/4TAifEd2jK"
986210286368710662,"In Latest Trade Salvo, China Imposes 179 Percent Tariff On U.S. Sorghum https://t.co/y9GyUyYJp3"
983759008506023936,#china #auto #tariffs #trade #soybeans #medicaldevices #aircraft #resilience #trading #export #semiconductors… https://t.co/cPecOIvkd5
